{
	"$schema": "http://json-schema.org/draft-07/schema#",
	"$id": "https://github.com/RebelliousSmile/obsidian-handbook/supervisor/train.schema.json",
	"title": "Supervisor train record",
	"description": "One correction coordinated across the repositories of supervisor/topology.json. The record is the source of truth; the coordination issue is a projection of it.",
	"type": "object",
	"additionalProperties": false,
	"required": [
		"$schema",
		"id",
		"title",
		"status",
		"coordinationIssue",
		"items",
		"publication"
	],
	"properties": {
		"$schema": {
			"const": "../train.schema.json"
		},
		"id": {
			"$ref": "#/definitions/id"
		},
		"title": {
			"type": "string",
			"minLength": 1
		},
		"status": {
			"enum": [
				"open",
				"closed"
			]
		},
		"coordinationIssue": {
			"$ref": "#/definitions/issueRef"
		},
		"items": {
			"type": "array",
			"items": {
				"$ref": "#/definitions/item"
			}
		},
		"approval": {
			"description": "Obsolete: written by the former supervise approve, no longer read. Kept so that older train records still validate.",
			"oneOf": [
				{
					"type": "null"
				},
				{
					"$ref": "#/definitions/approval"
				}
			]
		},
		"publication": {
			"description": "Written by supervise publish (phase 4), one entry per provider.",
			"type": "object",
			"additionalProperties": {
				"type": "object",
				"properties": {
					"candidate": {
						"$ref": "#/definitions/candidate"
					},
					"final": {
						"$ref": "#/definitions/archive"
					},
					"runs": {
						"description": "Every step supervise publish --run started, oldest first: a dispatched workflow or a local command.",
						"type": "array",
						"items": {
							"$ref": "#/definitions/run"
						}
					}
				}
			}
		},
		"presentation": {
			"description": "Written by supervise present: the commits, train files and publications that publish, converge and close are bound to.",
			"$ref": "#/definitions/presentation"
		},
		"convergence": {
			"description": "Written by supervise converge: the checks that proved every consumer adopted every final, at these SHAs.",
			"$ref": "#/definitions/convergence"
		},
		"consumerReleases": {
			"description": "Written by supervise release, one entry per consumer release it observed on GitHub, the coordinator last; supervise close checks them again.",
			"type": "array",
			"items": {
				"$ref": "#/definitions/consumerRelease"
			}
		},
		"closedAt": {
			"description": "Written by supervise close --run, once the coordination issue is closed.",
			"type": "string"
		}
	},
	"definitions": {
		"id": {
			"type": "string",
			"pattern": "^[a-z0-9]+(?:-[a-z0-9]+)*$"
		},
		"sha": {
			"type": "string",
			"pattern": "^[0-9a-f]{40}$"
		},
		"issueRef": {
			"type": "object",
			"additionalProperties": false,
			"required": [
				"repo",
				"number",
				"url"
			],
			"properties": {
				"repo": {
					"$ref": "#/definitions/id"
				},
				"number": {
					"type": "integer",
					"minimum": 1
				},
				"url": {
					"type": "string",
					"pattern": "^https://github\\.com/"
				}
			}
		},
		"item": {
			"type": "object",
			"additionalProperties": false,
			"required": [
				"repo",
				"issue",
				"url",
				"title",
				"baseSha",
				"dependsOn",
				"expectedEvidence"
			],
			"properties": {
				"repo": {
					"$ref": "#/definitions/id"
				},
				"issue": {
					"type": "integer",
					"minimum": 1
				},
				"url": {
					"type": "string",
					"pattern": "^https://github\\.com/"
				},
				"title": {
					"type": "string"
				},
				"baseSha": {
					"$ref": "#/definitions/sha"
				},
				"dependsOn": {
					"type": "array",
					"uniqueItems": true,
					"items": {
						"$ref": "#/definitions/id"
					}
				},
				"expectedEvidence": {
					"type": "array",
					"items": {
						"type": "string",
						"minLength": 1
					}
				}
			}
		},
		"trainFiles": {
			"type": "object",
			"additionalProperties": {
				"type": "array",
				"items": {
					"type": "string",
					"minLength": 1
				}
			}
		},
		"publications": {
			"type": "array",
			"items": {
				"type": "string",
				"minLength": 1
			}
		},
		"digest": {
			"type": "string",
			"pattern": "^sha256:[0-9a-f]{64}$"
		},
		"run": {
			"type": "object",
			"additionalProperties": false,
			"required": [
				"step",
				"conclusion",
				"at"
			],
			"properties": {
				"step": {
					"type": "string",
					"minLength": 1
				},
				"workflow": {
					"type": "string"
				},
				"inputs": {
					"type": "object",
					"additionalProperties": {
						"type": "string"
					}
				},
				"command": {
					"type": "array",
					"items": {
						"type": "string"
					}
				},
				"id": {
					"type": "integer"
				},
				"url": {
					"type": "string",
					"pattern": "^https://github\\.com/"
				},
				"conclusion": {
					"type": [
						"string",
						"null"
					]
				},
				"at": {
					"type": "string"
				}
			}
		},
		"candidate": {
			"description": "The candidate archive, with the commit it was packed from and the package fingerprint of that commit when the presentation held one; a record written before these two fields has neither.",
			"allOf": [
				{
					"$ref": "#/definitions/archive"
				}
			],
			"properties": {
				"commit": {
					"type": "string",
					"pattern": "^[0-9a-f]{40}$"
				},
				"packed": {
					"type": "string",
					"pattern": "^[0-9a-f]{64}$"
				}
			},
			"dependencies": {
				"commit": [
					"packed"
				],
				"packed": [
					"commit"
				]
			}
		},
		"archive": {
			"type": "object",
			"required": [
				"tag",
				"url",
				"sha256",
				"integrity"
			],
			"properties": {
				"tag": {
					"type": "string"
				},
				"url": {
					"type": "string",
					"pattern": "^https://github\\.com/"
				},
				"sha256": {
					"type": "string",
					"pattern": "^[0-9a-f]{64}$"
				},
				"integrity": {
					"type": "string",
					"pattern": "^sha512-"
				}
			}
		},
		"presentation": {
			"type": "object",
			"additionalProperties": false,
			"required": [
				"presentedAt",
				"presentable",
				"reasons",
				"digest",
				"repos",
				"trainFiles",
				"publications"
			],
			"properties": {
				"presentedAt": {
					"type": "string",
					"minLength": 1
				},
				"presentable": {
					"type": "boolean"
				},
				"reasons": {
					"type": "array",
					"items": {
						"type": "string"
					}
				},
				"digest": {
					"$ref": "#/definitions/digest"
				},
				"repos": {
					"type": "array",
					"items": {
						"type": "object",
						"additionalProperties": false,
						"required": [
							"repo",
							"role",
							"sha",
							"baseSha",
							"commits",
							"diffstat",
							"validations"
						],
						"properties": {
							"repo": {
								"$ref": "#/definitions/id"
							},
							"role": {
								"enum": [
									"coordinator",
									"provider",
									"consumer"
								]
							},
							"sha": {
								"$ref": "#/definitions/sha"
							},
							"baseSha": {
								"oneOf": [
									{
										"type": "null"
									},
									{
										"$ref": "#/definitions/sha"
									}
								]
							},
							"commits": {
								"type": "array",
								"items": {
									"type": "object",
									"additionalProperties": false,
									"required": [
										"sha",
										"subject"
									],
									"properties": {
										"sha": {
											"$ref": "#/definitions/sha"
										},
										"subject": {
											"type": "string"
										}
									}
								}
							},
							"diffstat": {
								"type": "string"
							},
							"validations": {
								"type": "array",
								"items": {
									"type": "object",
									"additionalProperties": false,
									"required": [
										"command",
										"status",
										"tail"
									],
									"properties": {
										"command": {
											"type": "array",
											"items": {
												"type": "string"
											}
										},
										"status": {
											"type": "integer"
										},
										"tail": {
											"type": "string"
										},
										"durationMs": {
											"type": "integer",
											"minimum": 0
										},
										"notRun": {
											"type": "string",
											"minLength": 1
										},
										"reused": {
											"type": "string",
											"minLength": 1
										}
									}
								}
							},
							"packed": {
								"type": "object",
								"additionalProperties": false,
								"required": [
									"sha256",
									"files"
								],
								"properties": {
									"sha256": {
										"type": "string",
										"pattern": "^[0-9a-f]{64}$"
									},
									"files": {
										"type": "integer",
										"minimum": 1
									},
									"contents": {
										"description": "Each published file with the sha256 of its content, CRLF read as LF: what the candidate archive is held to before a consumer adopts it. A presentation written before this field has none.",
										"type": "object",
										"additionalProperties": {
											"type": "string",
											"pattern": "^[0-9a-f]{64}$"
										}
									}
								}
							},
							"evidence": {
								"type": "object",
								"additionalProperties": false,
								"required": [
									"key",
									"provedAt"
								],
								"properties": {
									"key": {
										"type": "string",
										"pattern": "^[0-9a-f]{64}$"
									},
									"provedAt": {
										"type": "string",
										"minLength": 1
									}
								}
							},
							"linkedProviders": {
								"type": "array",
								"minItems": 1,
								"items": {
									"$ref": "#/definitions/id"
								}
							}
						}
					}
				},
				"trainFiles": {
					"$ref": "#/definitions/trainFiles"
				},
				"publications": {
					"$ref": "#/definitions/publications"
				}
			}
		},
		"approval": {
			"type": "object",
			"additionalProperties": false,
			"required": [
				"approvedAt",
				"digest",
				"repos",
				"trainFiles",
				"publications"
			],
			"properties": {
				"approvedAt": {
					"type": "string",
					"minLength": 1
				},
				"digest": {
					"$ref": "#/definitions/digest"
				},
				"repos": {
					"type": "array",
					"items": {
						"type": "object",
						"additionalProperties": false,
						"required": [
							"repo",
							"sha"
						],
						"properties": {
							"repo": {
								"$ref": "#/definitions/id"
							},
							"sha": {
								"$ref": "#/definitions/sha"
							}
						}
					}
				},
				"trainFiles": {
					"$ref": "#/definitions/trainFiles"
				},
				"publications": {
					"$ref": "#/definitions/publications"
				}
			}
		},
		"convergence": {
			"type": "object",
			"additionalProperties": false,
			"required": [
				"status",
				"at",
				"repos",
				"checks",
				"notes"
			],
			"properties": {
				"status": {
					"enum": [
						"passed",
						"failed"
					]
				},
				"at": {
					"type": "string"
				},
				"repos": {
					"type": "array",
					"items": {
						"type": "object",
						"additionalProperties": false,
						"required": [
							"repo",
							"sha"
						],
						"properties": {
							"repo": {
								"$ref": "#/definitions/id"
							},
							"sha": {
								"$ref": "#/definitions/sha"
							}
						}
					}
				},
				"checks": {
					"type": "array",
					"items": {
						"type": "object",
						"additionalProperties": false,
						"required": [
							"repo",
							"command",
							"status"
						],
						"properties": {
							"repo": {
								"$ref": "#/definitions/id"
							},
							"command": {
								"type": "array",
								"items": {
									"type": "string"
								}
							},
							"status": {
								"type": "integer"
							}
						}
					}
				},
				"notes": {
					"type": "array",
					"items": {
						"type": "string"
					}
				}
			}
		},
		"consumerRelease": {
			"type": "object",
			"additionalProperties": false,
			"required": [
				"repo",
				"version",
				"tag",
				"sha",
				"url"
			],
			"properties": {
				"repo": {
					"$ref": "#/definitions/id"
				},
				"version": {
					"type": "string",
					"minLength": 1
				},
				"tag": {
					"type": "string",
					"minLength": 1
				},
				"sha": {
					"$ref": "#/definitions/sha"
				},
				"url": {
					"type": "string",
					"pattern": "^https://github\\.com/"
				}
			}
		}
	}
}
